{"blockers":["paid_execution_not_authorized","second_selected_executable_stack_absent"],"campaign_id":"synthetic-bounded-campaign","contract_version":"1.0","manifest_id":"campaign-2026-08-29-manifest","planned_cells":[{"arm":"hard_stop_only","replicate":1,"stack_id":"claude-code-zai-glm-5-3","task_id":"exact-repetition-stall"},{"arm":"hard_stop_only","replicate":2,"stack_id":"claude-code-zai-glm-5-3","task_id":"exact-repetition-stall"},{"arm":"hard_stop_only","replicate":3,"stack_id":"claude-code-zai-glm-5-3","task_id":"exact-repetition-stall"},{"arm":"generic_rethink","replicate":1,"stack_id":"claude-code-zai-glm-5-3","task_id":"exact-repetition-stall"},{"arm":"generic_rethink","replicate":2,"stack_id":"claude-code-zai-glm-5-3","task_id":"exact-repetition-stall"},{"arm":"generic_rethink","replicate":3,"stack_id":"claude-code-zai-glm-5-3","task_id":"exact-repetition-stall"},{"arm":"semantic_reheating","replicate":1,"stack_id":"claude-code-zai-glm-5-3","task_id":"exact-repetition-stall"},{"arm":"semantic_reheating","replicate":2,"stack_id":"claude-code-zai-glm-5-3","task_id":"exact-repetition-stall"},{"arm":"semantic_reheating","replicate":3,"stack_id":"claude-code-zai-glm-5-3","task_id":"exact-repetition-stall"},{"arm":"hard_stop_only","replicate":1,"stack_id":"claude-code-zai-glm-5-3","task_id":"cycle-two-step"},{"arm":"hard_stop_only","replicate":2,"stack_id":"claude-code-zai-glm-5-3","task_id":"cycle-two-step"},{"arm":"hard_stop_only","replicate":3,"stack_id":"claude-code-zai-glm-5-3","task_id":"cycle-two-step"},{"arm":"generic_rethink","replicate":1,"stack_id":"claude-code-zai-glm-5-3","task_id":"cycle-two-step"},{"arm":"generic_rethink","replicate":2,"stack_id":"claude-code-zai-glm-5-3","task_id":"cycle-two-step"},{"arm":"generic_rethink","replicate":3,"stack_id":"claude-code-zai-glm-5-3","task_id":"cycle-two-step"},{"arm":"semantic_reheating","replicate":1,"stack_id":"claude-code-zai-glm-5-3","task_id":"cycle-two-step"},{"arm":"semantic_reheating","replicate":2,"stack_id":"claude-code-zai-glm-5-3","task_id":"cycle-two-step"},{"arm":"semantic_reheating","replicate":3,"stack_id":"claude-code-zai-glm-5-3","task_id":"cycle-two-step"},{"arm":"hard_stop_only","replicate":1,"stack_id":"claude-code-zai-glm-5-3","task_id":"unchanged-state"},{"arm":"hard_stop_only","replicate":2,"stack_id":"claude-code-zai-glm-5-3","task_id":"unchanged-state"},{"arm":"hard_stop_only","replicate":3,"stack_id":"claude-code-zai-glm-5-3","task_id":"unchanged-state"},{"arm":"generic_rethink","replicate":1,"stack_id":"claude-code-zai-glm-5-3","task_id":"unchanged-state"},{"arm":"generic_rethink","replicate":2,"stack_id":"claude-code-zai-glm-5-3","task_id":"unchanged-state"},{"arm":"generic_rethink","replicate":3,"stack_id":"claude-code-zai-glm-5-3","task_id":"unchanged-state"},{"arm":"semantic_reheating","replicate":1,"stack_id":"claude-code-zai-glm-5-3","task_id":"unchanged-state"},{"arm":"semantic_reheating","replicate":2,"stack_id":"claude-code-zai-glm-5-3","task_id":"unchanged-state"},{"arm":"semantic_reheating","replicate":3,"stack_id":"claude-code-zai-glm-5-3","task_id":"unchanged-state"},{"arm":"hard_stop_only","replicate":1,"stack_id":"claude-code-zai-glm-5-3","task_id":"repeated-error"},{"arm":"hard_stop_only","replicate":2,"stack_id":"claude-code-zai-glm-5-3","task_id":"repeated-error"},{"arm":"hard_stop_only","replicate":3,"stack_id":"claude-code-zai-glm-5-3","task_id":"repeated-error"},{"arm":"generic_rethink","replicate":1,"stack_id":"claude-code-zai-glm-5-3","task_id":"repeated-error"},{"arm":"generic_rethink","replicate":2,"stack_id":"claude-code-zai-glm-5-3","task_id":"repeated-error"},{"arm":"generic_rethink","replicate":3,"stack_id":"claude-code-zai-glm-5-3","task_id":"repeated-error"},{"arm":"semantic_reheating","replicate":1,"stack_id":"claude-code-zai-glm-5-3","task_id":"repeated-error"},{"arm":"semantic_reheating","replicate":2,"stack_id":"claude-code-zai-glm-5-3","task_id":"repeated-error"},{"arm":"semantic_reheating","replicate":3,"stack_id":"claude-code-zai-glm-5-3","task_id":"repeated-error"},{"arm":"hard_stop_only","replicate":1,"stack_id":"claude-code-zai-glm-5-3","task_id":"budget-burn-turns"},{"arm":"hard_stop_only","replicate":2,"stack_id":"claude-code-zai-glm-5-3","task_id":"budget-burn-turns"},{"arm":"hard_stop_only","replicate":3,"stack_id":"claude-code-zai-glm-5-3","task_id":"budget-burn-turns"},{"arm":"generic_rethink","replicate":1,"stack_id":"claude-code-zai-glm-5-3","task_id":"budget-burn-turns"},{"arm":"generic_rethink","replicate":2,"stack_id":"claude-code-zai-glm-5-3","task_id":"budget-burn-turns"},{"arm":"generic_rethink","replicate":3,"stack_id":"claude-code-zai-glm-5-3","task_id":"budget-burn-turns"},{"arm":"semantic_reheating","replicate":1,"stack_id":"claude-code-zai-glm-5-3","task_id":"budget-burn-turns"},{"arm":"semantic_reheating","replicate":2,"stack_id":"claude-code-zai-glm-5-3","task_id":"budget-burn-turns"},{"arm":"semantic_reheating","replicate":3,"stack_id":"claude-code-zai-glm-5-3","task_id":"budget-burn-turns"},{"arm":"hard_stop_only","replicate":1,"stack_id":"claude-code-zai-glm-5-3","task_id":"blocked-authority"},{"arm":"hard_stop_only","replicate":2,"stack_id":"claude-code-zai-glm-5-3","task_id":"blocked-authority"},{"arm":"hard_stop_only","replicate":3,"stack_id":"claude-code-zai-glm-5-3","task_id":"blocked-authority"},{"arm":"generic_rethink","replicate":1,"stack_id":"claude-code-zai-glm-5-3","task_id":"blocked-authority"},{"arm":"generic_rethink","replicate":2,"stack_id":"claude-code-zai-glm-5-3","task_id":"blocked-authority"},{"arm":"generic_rethink","replicate":3,"stack_id":"claude-code-zai-glm-5-3","task_id":"blocked-authority"},{"arm":"semantic_reheating","replicate":1,"stack_id":"claude-code-zai-glm-5-3","task_id":"blocked-authority"},{"arm":"semantic_reheating","replicate":2,"stack_id":"claude-code-zai-glm-5-3","task_id":"blocked-authority"},{"arm":"semantic_reheating","replicate":3,"stack_id":"claude-code-zai-glm-5-3","task_id":"blocked-authority"},{"arm":"hard_stop_only","replicate":1,"stack_id":"second-executable-stack-unavailable","task_id":"exact-repetition-stall"},{"arm":"hard_stop_only","replicate":2,"stack_id":"second-executable-stack-unavailable","task_id":"exact-repetition-stall"},{"arm":"hard_stop_only","replicate":3,"stack_id":"second-executable-stack-unavailable","task_id":"exact-repetition-stall"},{"arm":"generic_rethink","replicate":1,"stack_id":"second-executable-stack-unavailable","task_id":"exact-repetition-stall"},{"arm":"generic_rethink","replicate":2,"stack_id":"second-executable-stack-unavailable","task_id":"exact-repetition-stall"},{"arm":"generic_rethink","replicate":3,"stack_id":"second-executable-stack-unavailable","task_id":"exact-repetition-stall"},{"arm":"semantic_reheating","replicate":1,"stack_id":"second-executable-stack-unavailable","task_id":"exact-repetition-stall"},{"arm":"semantic_reheating","replicate":2,"stack_id":"second-executable-stack-unavailable","task_id":"exact-repetition-stall"},{"arm":"semantic_reheating","replicate":3,"stack_id":"second-executable-stack-unavailable","task_id":"exact-repetition-stall"},{"arm":"hard_stop_only","replicate":1,"stack_id":"second-executable-stack-unavailable","task_id":"cycle-two-step"},{"arm":"hard_stop_only","replicate":2,"stack_id":"second-executable-stack-unavailable","task_id":"cycle-two-step"},{"arm":"hard_stop_only","replicate":3,"stack_id":"second-executable-stack-unavailable","task_id":"cycle-two-step"},{"arm":"generic_rethink","replicate":1,"stack_id":"second-executable-stack-unavailable","task_id":"cycle-two-step"},{"arm":"generic_rethink","replicate":2,"stack_id":"second-executable-stack-unavailable","task_id":"cycle-two-step"},{"arm":"generic_rethink","replicate":3,"stack_id":"second-executable-stack-unavailable","task_id":"cycle-two-step"},{"arm":"semantic_reheating","replicate":1,"stack_id":"second-executable-stack-unavailable","task_id":"cycle-two-step"},{"arm":"semantic_reheating","replicate":2,"stack_id":"second-executable-stack-unavailable","task_id":"cycle-two-step"},{"arm":"semantic_reheating","replicate":3,"stack_id":"second-executable-stack-unavailable","task_id":"cycle-two-step"},{"arm":"hard_stop_only","replicate":1,"stack_id":"second-executable-stack-unavailable","task_id":"unchanged-state"},{"arm":"hard_stop_only","replicate":2,"stack_id":"second-executable-stack-unavailable","task_id":"unchanged-state"},{"arm":"hard_stop_only","replicate":3,"stack_id":"second-executable-stack-unavailable","task_id":"unchanged-state"},{"arm":"generic_rethink","replicate":1,"stack_id":"second-executable-stack-unavailable","task_id":"unchanged-state"},{"arm":"generic_rethink","replicate":2,"stack_id":"second-executable-stack-unavailable","task_id":"unchanged-state"},{"arm":"generic_rethink","replicate":3,"stack_id":"second-executable-stack-unavailable","task_id":"unchanged-state"},{"arm":"semantic_reheating","replicate":1,"stack_id":"second-executable-stack-unavailable","task_id":"unchanged-state"},{"arm":"semantic_reheating","replicate":2,"stack_id":"second-executable-stack-unavailable","task_id":"unchanged-state"},{"arm":"semantic_reheating","replicate":3,"stack_id":"second-executable-stack-unavailable","task_id":"unchanged-state"},{"arm":"hard_stop_only","replicate":1,"stack_id":"second-executable-stack-unavailable","task_id":"repeated-error"},{"arm":"hard_stop_only","replicate":2,"stack_id":"second-executable-stack-unavailable","task_id":"repeated-error"},{"arm":"hard_stop_only","replicate":3,"stack_id":"second-executable-stack-unavailable","task_id":"repeated-error"},{"arm":"generic_rethink","replicate":1,"stack_id":"second-executable-stack-unavailable","task_id":"repeated-error"},{"arm":"generic_rethink","replicate":2,"stack_id":"second-executable-stack-unavailable","task_id":"repeated-error"},{"arm":"generic_rethink","replicate":3,"stack_id":"second-executable-stack-unavailable","task_id":"repeated-error"},{"arm":"semantic_reheating","replicate":1,"stack_id":"second-executable